[
  {
    "起": "00:01.0",
    "止": "00:02.0",
    "文字": "今天必须",
    "类型": "台词字幕"
  },
  {
    "起": "00:02.0",
    "止": "00:03.0",
    "文字": "说清楚",
    "类型": "台词字幕"
  },
  {
    "起": "00:04.0",
    "止": "00:06.0",
    "文字": "我马上回来",
    "类型": "台词字幕"
  },
  {
    "起": "00:08.0",
    "止": "00:09.0",
    "文字": "你在门回等",
    "类型": "台词字幕"
  },
  {
    "起": "00:20.0",
    "止": "00:21.0",
    "文字": "只有字幕",
    "类型": "台词字幕"
  },
  {
    "起": "00:30.0",
    "止": "00:31.0",
    "文字": "ＡＢＣ　１２，出发！",
    "类型": "台词字幕"
  }
]
