[
  {
    "起": "00:05.0",
    "止": "00:07.0",
    "文字": "今天必须说清楚。",
    "类型": "台词字幕",
    "框": {
      "x": 0.1,
      "y": 0.7,
      "width": 0.8,
      "height": 0.1
    },
    "置信度": 0.99
  },
  {
    "起": "00:10.0",
    "止": "00:12.0",
    "文字": "合同的最后一页还没有签字。",
    "类型": "台词字幕",
    "框": {
      "x": 0.1,
      "y": 0.7,
      "width": 0.8,
      "height": 0.1
    },
    "置信度": 0.99
  },
  {
    "起": "00:18.0",
    "止": "00:19.0",
    "文字": "原件在这里。",
    "类型": "台词字幕",
    "框": {
      "x": 0.1,
      "y": 0.7,
      "width": 0.8,
      "height": 0.1
    },
    "置信度": 0.99
  }
]
